{
  "artifact_id": "V0_IPEC_WP3_VALIDATOR_RULE_REGISTRY",
  "contract_id": "V0-IPEC-0.1",
  "version": "0.1",
  "date": "2026-07-19",
  "status": "WP3_RULE_BINDINGS_FROZEN",
  "rule_namespace": "IPEC.RULE.<DOMAIN>.<NNN>",
  "rule_count": 36,
  "theorem_coverage": "T121-T156",
  "theorem_coverage_count": 36,
  "mapping_status": "BOUND",
  "typed_outcome_binding_status": "DEFERRED_TO_WP4",
  "conditional_theorem_ids": [
    "T140",
    "T150",
    "T156"
  ],
  "rules": [
    {
      "rule_id": "IPEC.RULE.GUARD.001",
      "primary_theorem_id": "T121",
      "supporting_theorem_ids": [],
      "canonical_name": "live_guard_has_a_live_token",
      "semantic_role": "live-token guard audit",
      "diagnostic_codes": [
        "UNGUARDED_VALUE_CLAIM"
      ],
      "source_bindings": [
        {
          "source_profile": "OSAP_FC1_V1_1_REGISTRY",
          "selector": "/claims[kind=has_value]",
          "binding_class": "EXACT_OSAP_CONSTRUCT_BINDING",
          "evaluation_mode": "DEFERRED_TO_WP4"
        },
        {
          "source_profile": "VALIDATOR_CORE_V0_12_FINITE_MODEL",
          "selector": "/dom_has/*",
          "binding_class": "LEGACY_STRUCTURAL_PROXY_BINDING",
          "evaluation_mode": "DEFERRED_NO_SEMANTIC_CERTIFICATION"
        }
      ],
      "claim_class": "PROVED_THEOREM",
      "conditional": false,
      "conditional_premises": [],
      "statement_sha256": "babb17eac963e89433881717373d9c989ea0438f68559359ba105593e4807557",
      "statement_hash_class": "DERIVED_PHASE1_NORMALIZATION",
      "mapping_status": "BOUND",
      "binding_owner": "V0-IPEC-0.1-WP3",
      "canonical_theorem_owner": "V0_OSAP_V1_3_0",
      "source_release": {
        "repository": "olegovation-ship-it/v0-osap-formal-core",
        "ref": "v1.3.0",
        "commit": "13bf095688bcabd5b090f188e9bd28a16237edeb",
        "doi": "10.5281/zenodo.21346728",
        "source_path": "release/v1.3.0/theorem_crosswalk_phase1.json"
      },
      "limitations": [
        "Rule binding identifies the theorem-backed semantic obligation; WP3 does not bind final typed outcomes.",
        "Adapter production of a DEFERRED obligation is not evidence that the theorem premises hold.",
        "No checker completeness, proof-term identity, empirical validation, or physical validation is claimed."
      ],
      "rule_record_sha256": "18cab909609263adcd8f0ec88b32a4f0aa13d084273ec7c30483dc50a41cc1f6"
    },
    {
      "rule_id": "IPEC.RULE.PREREQUISITE.001",
      "primary_theorem_id": "T122",
      "supporting_theorem_ids": [],
      "canonical_name": "empty_all_of_prerequisite_family_is_vacuously_satisfied",
      "semantic_role": "empty all_of and prerequisite-family audit",
      "diagnostic_codes": [
        "MISSING_PREREQUISITE"
      ],
      "source_bindings": [
        {
          "source_profile": "OSAP_FC1_V1_1_REGISTRY",
          "selector": "/prerequisite_families[mode=all_of]",
          "binding_class": "EXACT_OSAP_CONSTRUCT_BINDING",
          "evaluation_mode": "DEFERRED_TO_WP4"
        }
      ],
      "claim_class": "PROVED_THEOREM",
      "conditional": false,
      "conditional_premises": [],
      "statement_sha256": "f9fbfc75b7334c765f03a90c702e67d13a67c00bd00a56966da2e831d04b4e9b",
      "statement_hash_class": "DERIVED_PHASE1_NORMALIZATION",
      "mapping_status": "BOUND",
      "binding_owner": "V0-IPEC-0.1-WP3",
      "canonical_theorem_owner": "V0_OSAP_V1_3_0",
      "source_release": {
        "repository": "olegovation-ship-it/v0-osap-formal-core",
        "ref": "v1.3.0",
        "commit": "13bf095688bcabd5b090f188e9bd28a16237edeb",
        "doi": "10.5281/zenodo.21346728",
        "source_path": "release/v1.3.0/theorem_crosswalk_phase1.json"
      },
      "limitations": [
        "Rule binding identifies the theorem-backed semantic obligation; WP3 does not bind final typed outcomes.",
        "Adapter production of a DEFERRED obligation is not evidence that the theorem premises hold.",
        "No checker completeness, proof-term identity, empirical validation, or physical validation is claimed."
      ],
      "rule_record_sha256": "872117875af73ce298e699e6fd3dd440cb903690aaaff7bfe12dc36ba22a309e"
    },
    {
      "rule_id": "IPEC.RULE.DLE.001",
      "primary_theorem_id": "T123",
      "supporting_theorem_ids": [],
      "canonical_name": "dle_implies_current_no_live_status",
      "semantic_role": "current no-live consequence of DLE",
      "diagnostic_codes": [
        "DLE_CONFLICTS_WITH_LIVE_TOKEN"
      ],
      "source_bindings": [
        {
          "source_profile": "OSAP_FC1_V1_1_REGISTRY",
          "selector": "/claims[kind=dle]",
          "binding_class": "EXACT_OSAP_CONSTRUCT_BINDING",
          "evaluation_mode": "DEFERRED_TO_WP4"
        }
      ],
      "claim_class": "PROVED_THEOREM",
      "conditional": false,
      "conditional_premises": [],
      "statement_sha256": "fb907509c5f7c7710dd739cbfe7eb8a6aed6fbb38d10981012867e7f377b7a4b",
      "statement_hash_class": "DERIVED_PHASE1_NORMALIZATION",
      "mapping_status": "BOUND",
      "binding_owner": "V0-IPEC-0.1-WP3",
      "canonical_theorem_owner": "V0_OSAP_V1_3_0",
      "source_release": {
        "repository": "olegovation-ship-it/v0-osap-formal-core",
        "ref": "v1.3.0",
        "commit": "13bf095688bcabd5b090f188e9bd28a16237edeb",
        "doi": "10.5281/zenodo.21346728",
        "source_path": "release/v1.3.0/theorem_crosswalk_phase1.json"
      },
      "limitations": [
        "Rule binding identifies the theorem-backed semantic obligation; WP3 does not bind final typed outcomes.",
        "Adapter production of a DEFERRED obligation is not evidence that the theorem premises hold.",
        "No checker completeness, proof-term identity, empirical validation, or physical validation is claimed."
      ],
      "rule_record_sha256": "e00aaad09eb9ddfa2ff1bd0b05af8a1905dcf42cefa71cf4f7efe660df50d1f9"
    },
    {
      "rule_id": "IPEC.RULE.RESIDUAL.001",
      "primary_theorem_id": "T124",
      "supporting_theorem_ids": [],
      "canonical_name": "live_residual_obstructs_robust_relative_v0",
      "semantic_role": "robust relative-V0 live-residual audit",
      "diagnostic_codes": [
        "LIVE_RESIDUAL_OBSTRUCTS_ROBUST_RELATIVE_V0"
      ],
      "source_bindings": [
        {
          "source_profile": "OSAP_FC1_V1_1_REGISTRY",
          "selector": "/claims[kind=robust_relative_v0]",
          "binding_class": "EXACT_OSAP_CONSTRUCT_BINDING",
          "evaluation_mode": "DEFERRED_TO_WP4"
        },
        {
          "source_profile": "VALIDATOR_CORE_V0_12_FINITE_MODEL",
          "selector": "/links[type=ResidueLink]",
          "binding_class": "LEGACY_STRUCTURAL_PROXY_BINDING",
          "evaluation_mode": "DEFERRED_NO_SEMANTIC_CERTIFICATION"
        }
      ],
      "claim_class": "PROVED_THEOREM",
      "conditional": false,
      "conditional_premises": [],
      "statement_sha256": "a8a434dacaaffd132bb762630e9ee01c50e9963938b970e24256faa9ada40d79",
      "statement_hash_class": "DERIVED_PHASE1_NORMALIZATION",
      "mapping_status": "BOUND",
      "binding_owner": "V0-IPEC-0.1-WP3",
      "canonical_theorem_owner": "V0_OSAP_V1_3_0",
      "source_release": {
        "repository": "olegovation-ship-it/v0-osap-formal-core",
        "ref": "v1.3.0",
        "commit": "13bf095688bcabd5b090f188e9bd28a16237edeb",
        "doi": "10.5281/zenodo.21346728",
        "source_path": "release/v1.3.0/theorem_crosswalk_phase1.json"
      },
      "limitations": [
        "Rule binding identifies the theorem-backed semantic obligation; WP3 does not bind final typed outcomes.",
        "Adapter production of a DEFERRED obligation is not evidence that the theorem premises hold.",
        "No checker completeness, proof-term identity, empirical validation, or physical validation is claimed."
      ],
      "rule_record_sha256": "e52fcaad64f47552d3edbf1ae96e1ead60befc5058bfac549ab0b932d4cbc006"
    },
    {
      "rule_id": "IPEC.RULE.OBSERVER.001",
      "primary_theorem_id": "T125",
      "supporting_theorem_ids": [],
      "canonical_name": "terminal_self_certificate_exposes_empty_internal_and_external_support",
      "semantic_role": "terminal support-exhaustion audit",
      "diagnostic_codes": [
        "TERMINAL_SELF_CERTIFICATE_NOT_EXHAUSTED"
      ],
      "source_bindings": [
        {
          "source_profile": "OSAP_FC1_V1_1_REGISTRY",
          "selector": "/claims[kind=observer_terminal_self_certificate]",
          "binding_class": "EXACT_OSAP_CONSTRUCT_BINDING",
          "evaluation_mode": "DEFERRED_TO_WP4"
        }
      ],
      "claim_class": "PROVED_THEOREM",
      "conditional": false,
      "conditional_premises": [],
      "statement_sha256": "d92314a732e2647ccf1246b8b7f03aa2e3558df8b08fcce65d8cdefc7dae7f55",
      "statement_hash_class": "DERIVED_PHASE1_NORMALIZATION",
      "mapping_status": "BOUND",
      "binding_owner": "V0-IPEC-0.1-WP3",
      "canonical_theorem_owner": "V0_OSAP_V1_3_0",
      "source_release": {
        "repository": "olegovation-ship-it/v0-osap-formal-core",
        "ref": "v1.3.0",
        "commit": "13bf095688bcabd5b090f188e9bd28a16237edeb",
        "doi": "10.5281/zenodo.21346728",
        "source_path": "release/v1.3.0/theorem_crosswalk_phase1.json"
      },
      "limitations": [
        "Rule binding identifies the theorem-backed semantic obligation; WP3 does not bind final typed outcomes.",
        "Adapter production of a DEFERRED obligation is not evidence that the theorem premises hold.",
        "No checker completeness, proof-term identity, empirical validation, or physical validation is claimed."
      ],
      "rule_record_sha256": "34390faa104f85cf7d110f67b3c07a19a994ba86854de02850f4d20f0c78abf0"
    },
    {
      "rule_id": "IPEC.RULE.FIREWALL.001",
      "primary_theorem_id": "T126",
      "supporting_theorem_ids": [],
      "canonical_name": "direct_branch_local_to_absolute_promotion_violates_the_firewall",